<?xml version="1.0" encoding="UTF-8"?>

<temperatura xmlns:xsi="http://www.w3.org/2001/XMLSchema-instance" 
    xsi:noNamespaceSchemaLocation="https://raw.githubusercontent.com/andrespena9010/XML/refs/heads/xsd/temperatura.xsd">

	<provincia>Zamora</provincia>
	<fecha>2022-01-07</fecha>
	<temperatura_minima>-5</temperatura_minima>
	<temperatura_maxima>4</temperatura_maxima>
	<incidencias>
		<incidencia nombre="frio" severidad="alta"/>
		<incidencia nombre="nieve" severidad="alta"/>
		<incidencia nombre="lluvia" severidad="media"/>
	</incidencias>
</temperatura> 
